,docno,recipe_name,ingredients,recipe,rate,views,keywords,description,calories,fatContent,proteinContent,url,rank,filtering
18,31141,Heart Healthy Personal Pizza,"1       6 inch fat-free whole wheat pita bread,1/3  cup    tomato sauce,3   ounces    lowfat mozzarella cheese,1/2  cup    broccoli (steamed),2       garlic cloves (or jarred garlic like christopher ranch),1   teaspoon    olive oil,1   tablespoon    black olives (chopped)","Pre heat pizza stone in a 400 degrees oven.,Saut&eacute; garlic and broccoli.,Carefully cut a pocket into the center of the pita, but be careful not to slice through, then stuff inside with the saut&eacute;ed steamed Broccoli and garlic.,Spread Tomato Sauce on top of the Pita.,Sprinkle black olive and mozzarella on top and place in the oven on the pizza stone. (Regular pizza pan or piece of aluminum foil can be used it you do not have a pizza stone).,Bake for approximately 12 -15 minutes until cheese is melted and lightly browned.,Remove from oven and cut into quarters and enjoy!",4.0,1,european mins,"i donât know about you, but if i canât have pizza on my diet i feel as though i am being denied one of the basic four-food groups.  i have created this recipe as one of my lunch choices for a very strict 1800-calorie per day low fat cardiac diet.  i finish off with 1 cup of strawberries and water or a non-caloric beverage for a tasty, low calorie and more heart healthy lunch.",309.8,19.3,23.5,food.com,18,"1 6 inch fat-free whole wheat pita bread,1/3 cup tomato sauce,3 ounce lowfat mozzarella cheese,1/2 cup broccoli ( steamed ) ,2 garlic clove ( or jarred garlic like christopher ranch ) ,1 teaspoon olive oil,1 tablespoon black olive ( chopped ) i donât know about you , but if i canât have pizza on my diet i feel a though i am being denied one of the basic four-food group . i have created this recipe a one of my lunch choice for a very strict 1800-calorie per day low fat cardiac diet . i finish off with 1 cup of strawberry and water or a non-caloric beverage for a tasty , low calorie and more heart healthy lunch . european min"
19,15038,Super Easy No-Cook Pizza Sauce,"1 (14 1/2  ounce) can   italian-style diced tomatoes (i use hunt's brand with basil, oregano and garlic),1   teaspoon    dried basil,1   teaspoon    dried oregano,2 -3   cloves    garlic","Place all ingredients in a food processor or blender and process until the mixture is somewhat smooth (a few chunks are nice).,Use with store-bought pizza dough, Boboli bread, or your own homemade pizza dough, and top and bake as normal.",4.0,1,vegetable european low protein vegan low cholesterol healthy kid friendly spicy mins no cook beginner cook easy inexpensive,"i was looking around my pantry for pizza sauce recently, and didn't find any, so i whipped this up, and it was delicious and very easy! fresh herbs can be substituted for dried ones when in season.",30.2,0.2,1,food.com,19,"1 ( 14 1/2 ounce ) can italian-style diced tomato ( i use hunt 's brand with basil , oregano and garlic ) ,1 teaspoon dried basil,1 teaspoon dried oregano,2 -3 clove garlic i wa looking around my pantry for pizza sauce recently , and did n't find any , so i whipped this up , and it wa delicious and very easy ! fresh herb can be substituted for dried one when in season . vegetable european low protein vegan low cholesterol healthy kid friendly spicy min no cook beginner cook easy inexpensive"
20,53353,Chicken Caesar Salad Pizza (Biscuit Crust),"2   cups    all-purpose flour,1   tablespoon    baking powder,1/4  teaspoon    salt,2/3  cup    water,1   tablespoon    cooking oil,1   teaspoon    cooking oil,1/2  lb    boneless skinless chicken breast half (about 2),  salt, sprinkle ,  pepper, sprinkle ,1/2  cup   creamy light caesar salad dressing,3/4  cup   grated part-skim mozzarella cheese,2   cups   finely chopped romaine lettuce,1/4  cup   creamy light caesar salad dressing,3   tablespoons   grated parmesan cheese","FOR THE BISCUIT PIZZA CRUST:  Stir flour, baking powder and salt together in medium bowl.,Add water and cooking oil.  Stir to form soft ball.  Knead on lightly floured surface 8 to 10 times.  Roll out and press in greased 12 inch pizza pan, forming rim around edge.,NOTE:  You can use this crust to make a thin biscuit pizza crust:  Reduce flour to 1 1/2 cups.  Reduce water to 1/2 cup.  Crust will cook a bit quicker.,Wheat Biscuit Pizza Crust:  Use whole wheat flour for half of all purpose flour called for.,FOR THE TOPPING:  Prepare pizza dough.  Roll out and press in greased 12 inch pizza pan, forming rim around edge.,Place cooking oil and chicken in medium non stick frying pan.  Sprinkle with salt and pepper.  Saute for about 5 minutes until chicken is cooked.,Spread first amount of Caesar dressing over crust.  Sprinkle mozzarella cheese over dressing.  Scatter chicken over top.  Bake on bottom rack in 425&deg;F oven for 13 to 15 minutes, or for 8 minutes if using partially baked crust. Take pizza out of oven and spoon on Caesar salad.,Toss lettuce with second amount of Caesar dressing in large bowl.  Spoon over top.  Sprinkle with Parmesan cheese.  Serve hot.  Cuts into 8 wedges.,Companyâs Coming Pizza!",0.0,0,breads healthy high in mins,like a chicken caesar salad on bread.  more chicken may be added if desired.  the pizza crust is quicker to prepare than a yeast crust.,254.7,7.9,15.9,food.com,20,"2 cup all-purpose flour,1 tablespoon baking powder,1/4 teaspoon salt,2/3 cup water,1 tablespoon cooking oil,1 teaspoon cooking oil,1/2 lb boneless skinless chicken breast half ( about 2 ) , salt , sprinkle , pepper , sprinkle ,1/2 cup creamy light caesar salad dressing,3/4 cup grated part-skim mozzarella cheese,2 cup finely chopped romaine lettuce,1/4 cup creamy light caesar salad dressing,3 tablespoon grated parmesan cheese like a chicken caesar salad on bread . more chicken may be added if desired . the pizza crust is quicker to prepare than a yeast crust . bread healthy high in min"
21,11325,Cornmeal Crust,"2 1/3  cups    water,1   cup    yellow cornmeal,1   tablespoon    butter,1/4  teaspoon    salt,1/8  teaspoon    ground red pepper","Heat oven to 425.  Grease 12 inch pizza pan with shortening.,Heat water to boiling in 2-quart saucepan.,Stir in remaining ingredients with wire whisk until mixture is smooth and thickens.,Spoon onto pizza pan and spread evenly, mounding edge slightly.,Bake 5 to 7 minutes or until set and light brown.,After you top pizza with your favorite toppings, bake for 15 to 20 minutes or until cheese is melted and toppings are hot.",5.0,1,low protein low cholesterol healthy mins easy,i needed to make another pizza crust and didn't have time for the dough to rise.  this was super simple and quite good.  who knew?  recipe courtesy of betty crocker's new cookbook.,90.7,2.7,1.7,food.com,21,"2 1/3 cup water,1 cup yellow cornmeal,1 tablespoon butter,1/4 teaspoon salt,1/8 teaspoon ground red pepper i needed to make another pizza crust and did n't have time for the dough to rise . this wa super simple and quite good . who knew ? recipe courtesy of betty crocker 's new cookbook . low protein low cholesterol healthy min easy"
23,885,5-Minute Artisan Pizza Dough,"3   cups   lukewarm water (100f or below),3   tablespoons   lukewarm water (100f or below),1/3  cup    olive oil,1   tablespoon    granulated yeast,1 1/2  tablespoons    kosher salt,7 1/2  cups    unbleached all-purpose flour","Combine warm water (about 100F), olive oil, yeast and salt in a 5-quart bowl; preferably, in a lidded (not airtight) plastic container or food-grade bucket.,Measure the flour using a &quot;swoop and sweep&quot; method.  Reach into the flour bin with your measuring cup, scooping up a full measure all at once, and sweeping it level with a knife.,Mix until all of the flour is incorproated (kneading is not necessary) using a wooden spoon or a food processor with a dough attachment.,Cover with a non-airtight lid.,Allow to rise at room temperature for 2 hours.,DO NOT PUNCH DOWN!  You want to retain as much gas in the dough as possible.  A reduction in gas will make your pizzas and flatbreads dense.,Refrigerate and use over the next 14 days.  Refigerate at least 3 hours before using.,On Pizza Day.,30 minutes before you're ready to bake, place a pizza stone at the bottom third of the oven and preheat it at your oven's highest temperature.,Prepare and organize your toppings.,Dust a pizza peel (or a large cutting board/flat cookie sheet) with enough flour or cornmeal to easily tranfer the pizza over to the hot stone.,Pull up and cut off a 1/2 pound (orange-size) piece of dough.,Using a little flour (enough so it won't stick to your fingers), stretch and shape the dough into a ball.,Sprinkle your work area with a little flour.  Using your hands or a rolling pin, roll out and stretch the dough until it is approximately 1/8&quot; thick and 12&quot; wide.,Place the finished dough onto the prepared pizza peel and add the toppings of your choice.,Carefully slide the pizza onto the hot stone (if it isn't sliding, you will need to sprinkle more flour or cornmeal between the pizza and the pizza peel, until it moves.,Check for doneness after 8-10 minutes - it may take a few minutes longer.  Turn the pizza around if the one side is browning faster than the other.,Allow to cool slightly on a wire rack.",5.0,5,breads low cholesterol healthy kid friendly mins easy,"love, love this recipe!  so many great things to say about it: ridiculously easy to make, incredibly delicious, and it can be stored in your fridge for up to 2 weeks.  perfect for an afterschool snack or an easy dinner!  don't get overwhelmed by all of the instructions - you just have to read through them once - its basic pizza making.  from the book artisan pizza and flatbread in five minutes a day.",416.5,8.4,11.1,food.com,23,"3 cup lukewarm water ( 100f or below ) ,3 tablespoon lukewarm water ( 100f or below ) ,1/3 cup olive oil,1 tablespoon granulated yeast,1 1/2 tablespoon kosher salt,7 1/2 cup unbleached all-purpose flour love , love this recipe ! so many great thing to say about it : ridiculously easy to make , incredibly delicious , and it can be stored in your fridge for up to 2 week . perfect for an afterschool snack or an easy dinner ! do n't get overwhelmed by all of the instruction - you just have to read through them once - it basic pizza making . from the book artisan pizza and flatbread in five minute a day . bread low cholesterol healthy kid friendly min easy"
24,27408,Sunny's Pizza Dough,"1   cup    warm water,1   tablespoon    yeast,1   teaspoon    sugar,2   tablespoons    oil,2   teaspoons    salt,2 1/2  cups    flour","Make the yeast by combining the water yeast and sugar.,Once the yeast has grown, combine all ingredients.,Knead into dough.,Spread out on pizza pans.,Prick dough with a fork.,Bake 3 to 5 minutes before putting toppings on and baking the pizza.",5.0,1,canadian low cholesterol healthy mins,make and share this sunny's pizza dough recipe from food.com.,238.3,5.1,6.2,food.com,24,"1 cup warm water,1 tablespoon yeast,1 teaspoon sugar,2 tablespoon oil,2 teaspoon salt,2 1/2 cup flour make and share this sunny 's pizza dough recipe from food.com . canadian low cholesterol healthy min"
25,2142,Veggie Pizza  &quot;no Crust!!!&quot;,"1       portabella mushroom, cap ,1/4  cup   sliced bell pepper (green,yellow whatever you like),2   tablespoons    marinara sauce (i used pasta sauce),1   tablespoon    parmesan cheese, grated  (kraft-light is good),1/4  cup    onion, sliced ","Place the mushroom cap upside down on a cookie sheet. Spread the marinara sauce over the mushroom, and top with the remaining ingredients - just like a normal pizza.,Bake in the oven at 350&deg;F until the cheese melts and the âpizzaâ?is warmed through.",5.0,17,vegetable low protein low cholesterol healthy mins beginner cook easy,i found this recipe while looking for low calorie meals.  i must say this was the best &quot;pizza&quot; i ever had!!  can be used as an appetizer or snack.  i use it in my low calorie diet as a dinner.,91.4,2.7,5,food.com,25,"1 portabella mushroom , cap ,1/4 cup sliced bell pepper ( green , yellow whatever you like ) ,2 tablespoon marinara sauce ( i used pasta sauce ) ,1 tablespoon parmesan cheese , grated ( kraft-light is good ) ,1/4 cup onion , sliced i found this recipe while looking for low calorie meal . i must say this wa the best & quot ; pizza & quot ; i ever had ! ! can be used a an appetizer or snack . i use it in my low calorie diet a a dinner . vegetable low protein low cholesterol healthy min beginner cook easy"
27,56803,Muffuletta Bread,"1   cup    water,1   tablespoon    honey,1   teaspoon    salt,2   tablespoons    lard,3   cups    flour (i use 1 cup wheat to 2 cups white),2   teaspoons    yeast","Proof the yeast with the honey with 1/3 water then mix rest of ingredient's.,Knead for 5 minutes.  Let rise till doubled.,Knead for 5 more minutes and let let rise again.,Form in round on pizza stone and bake on pizza stone at 375&deg; for 30 minutes, till brown.",0.0,0,breads low cholesterol healthy hours easy,make and share this muffuletta bread recipe from food.com.,420.8,7.4,10.5,food.com,27,"1 cup water,1 tablespoon honey,1 teaspoon salt,2 tablespoon lard,3 cup flour ( i use 1 cup wheat to 2 cup white ) ,2 teaspoon yeast make and share this muffuletta bread recipe from food.com . bread low cholesterol healthy hour easy"
28,4346,Michael Symon's Homemade Pizza Sauce,"1 (15   ounce) can   whole canned tomatoes (drained),2       garlic cloves (sliced),1   tablespoon    dried oregano,1   tablespoon    dried basil,  salt,  fresh ground black pepper","Combine the drained tomatoes, garlic, and dried herbs in a blender or food processor. Pulse until the desired consistency. I like to leave this one a little bit course.,Pour into a bowl and season with salt and pepper.  *This is a raw pizza sauce, meant to be cooked on the pizza.* .",5.0,5,low protein low cholesterol healthy mins easy,make and share this michael symon's homemade pizza sauce recipe from food.com.,94.6,0.8,4.5,food.com,28,"1 ( 15 ounce ) can whole canned tomato ( drained ) ,2 garlic clove ( sliced ) ,1 tablespoon dried oregano,1 tablespoon dried basil , salt , fresh ground black pepper make and share this michael symon 's homemade pizza sauce recipe from food.com . low protein low cholesterol healthy min easy"
29,10754,Pizza Base for the Bread Maker,"1 1/2  cups    warm water,2   tablespoons    garlic-flavored olive oil,4   cups    flour,1 1/2  teaspoons    salt,1/3  cup    fresh parmesan cheese, finely grated ,1   teaspoon    dry oregano,1   teaspoon    dry basil,1   teaspoon    dried parsley,3   teaspoons    active dry yeast,1   teaspoon    sugar,1   tablespoon    powdered milk","Measure all the ingredients into the pan of the bread maker - the order given will give the best results.,Run the machine on the dough only cycle.,Press down to deflate slightly and rest for 30 minutes and heat the oven up with a heavy flat tray or pizza stone on the lowest rack.,Spread/stretch/roll out to fit your pizza pan.,Top with your favorite toppings.,Place into your hot oven, still in the pizza pan, on top of the hot tray and bake at 220C for 15-20 minutes.",4.0,5,healthy bread machine mins small appliance inexpensive,make and share this pizza base for the bread maker recipe from food.com.,384.2,7.4,12,food.com,29,"1 1/2 cup warm water,2 tablespoon garlic-flavored olive oil,4 cup flour,1 1/2 teaspoon salt,1/3 cup fresh parmesan cheese , finely grated ,1 teaspoon dry oregano,1 teaspoon dry basil,1 teaspoon dried parsley,3 teaspoon active dry yeast,1 teaspoon sugar,1 tablespoon powdered milk make and share this pizza base for the bread maker recipe from food.com . healthy bread machine min small appliance inexpensive"
